Nombre Propiedad,Precio,Dormitorios,Baños,Metros Cuadrados,Dirección
Excelente Departamento Y Ubicación,$440.000,2 dormitorios,1 baño,43 m² útiles,Av. Vicuña Mackenna Poniente 6300 ...
Hermoso Departamento 3 Dormitorio 2 Baños Piscinas-club Hous,$730.000,3 dormitorios,2 baños,90 m² útiles,"Walker Martínez 2991, La Florida A..."
Departamento 1d/1b A Una Cuadra De Metro Mirador Linea 5,UF8,1 dormitorio,1 baño,35 m² útiles,"Av. Vicuña Mackenna Ote. 6553, Met..."
Arriendo Departamento 1d/1b Dueño Directo,$360.000,1 dormitorio,1 baño,32 m² útiles,"Departamental 1475, Plaza Vespucio..."
Amplio Departamento 1 Dorm  En La Concepción 7633,$450.000,1 dormitorio,1 baño,42 m² útiles,"La Concepcion 7633, Vicente Valdés..."
Depto 3d/2b + Closet Sector Walker Martinez/colombia,$480.000,3 dormitorios,2 baños,69 m² útiles,"Juan De Pineda 8044, La Florida, V..."
Depto 1d/1b Metro Mirador (mall Florida Center),$290.000,1 dormitorio,1 baño,33 m² útiles,"Av. Vicuña Mackenna Poniente 6436,..."
Metro Rojas Magallanes / Con Estac. / Disp. 1 Diciembre,$490.000,2 dormitorios,2 baños,60 m² útiles,"Argentina 8577, Rojas Magallanes, ..."
Departamento En Arriendo De 3 Dorm. En La Florida,$550.000,3 dormitorios,2 baños,65 m² útiles,A Pasos Del Mall Bellavista La Flo...
Departamento Mariposa - Metro Mirador - Mall Florida Center,$430.000,2 dormitorios,2 baños,51 m² útiles,Av. Vicuña Mackenna Poniente 6300 ...
Tu Hogar En La Florida,$420.000,2 dormitorios,2 baños,51 m² útiles,"Av. Vicuña Mackenna 6131 - 300, 0,..."
Hermoso Departamento En Arriendo,$890.000,3 dormitorios,2 baños,90 m² útiles,"Camino Del Monte 6151 - 300, 0, Lo..."
Arriendo Nuevo Departamento 1d+1b La Florida,$320.000,1 dormitorio,1 baño,37 m² útiles,"La Concepcion, 7500 - 7800, Vicent..."
"Arriendo Departamento Mariposa, 2 D+2b+1e+1b, Sector Mim",$490.000,2 dormitorios,2 baños,52 m² útiles,"Av. Punta Arenas 6900, Plaza Vespu..."
"Arriendo Precioso Departamento 2 D+2b, La Florida",$490.000,2 dormitorios,2 baños,52 m² útiles,"Av. Punta Arenas 6900, Plaza Vespu..."
"Depto En Piso 3, 3d+1b+1estac, A 650 Mts Metro Trinidad",$460.000,3 dormitorios,1 baño,53 m² útiles,"Sta. Amalia 0161, La Florida"
Tranquilo Y Hermoso Departamento.,$420.000,2 dormitorios,1 baño,65 m² útiles,"García Hurtado De Mendoza 7958, La..."
Arriendo De Dpto Moderno En La Florida,$440.000,2 dormitorios,1 baño,44 m² útiles,"Av Diego Portales, 0, Los Quillaye..."
Arriendo De Dpto Moderno En La Florida,$450.000,2 dormitorios,2 baños,47 m² útiles,"Av Diego Portales, 0, Los Quillaye..."
Departamento Metro Y Mall Plaza Vespucio,$390.000,1 dormitorio,1 baño,32 m² útiles,"Bellavista 7150, Plaza Vespucio, L..."
Departamento Walker Martinez/avenida La Florida,$430.000,2 dormitorios,2 baños,46 m² útiles,"Walker Martínez 1600, La Florida, ..."
Departamento Walker Martinez/avenida La Florida,$460.000,2 dormitorios,2 baños,46 m² útiles,"Walker Martínez 1600, La Florida"
Departamento En Arriendo De 2 Dorm. En La Florida,$450.000,2 dormitorios,2 baños,50 m² útiles,"Mall Plaza Vespucio, Plaza Vespuci..."
Amplio Dpto 36/42m2 Punta Arenas 1d 1b Estac Y Bodega Nuevo!,$380.000,1 dormitorio,1 baño,36 m² útiles,Ma - Punta Arenas Con Mirador Azul...
"Depto. 3 Dormitorios &#43; 2 Baños, Metro Mirador, Estac. Y",$550.000,3 dormitorios,2 baños,77 m² útiles,"Metro Mirador, Metro Mirador, La F..."
Departamento En Arriendo De 2 Dorm. En La Florida,$500.000,2 dormitorios,2 baños,75 m² útiles,"Walker Martínez Con Tobalaba, La F..."
La Florida. Calle Paso El Roble 50. Deptos Nuevos,$430.000,2 dormitorios,2 baños,45 m² útiles,Calle Paso El Roble Con Av. Vicuña...
Departamento En Arriendo En La Florida,$385.000,1 dormitorio,1 baño,34 m² útiles,"Okinawa 6.930, La Florida"
"Paso El Roble 50, La Florida. Deptos Nuevos",$340.000,1 dormitorio,1 baño,31 m² útiles,Calle Paso El Roble Con Av. Vicuña...
Departamento En Arriendo De 2 Dorm. En La Florida,$490.000,2 dormitorios,1 baño,41 m² útiles,"Rodriguez Velasco 10, Vicente Vald..."
"Arriendo Departamento 2d,2b, Estac Y Bodega El Hualle",$600.000,2 dormitorios,2 baños,58 m² útiles,"El Hualle, Lo Cañas - Alto Macul, ..."
Departamento En Arriendo 3 Dorm. La Florida,$450.000,3 dormitorios,1 baño,48 m² útiles,Walker Martinez Con Garcia Hurtado...
Departamento En Arriendo 1 Dorm. La Florida,$370.000,1 dormitorio,1 baño,36 m² útiles,Calle Nueva Con Vicuña Mackenna Or...
Departamento En Arriendo De 2 Dorm. En La Florida,$520.000,2 dormitorios,2 baños,55 m² útiles,"Punta Arenas / Atahualpa, Plaza Ve..."
Depto En Arriendo De 2 Dorm. En La Florida Metro Mirador,$500.000,2 dormitorios,2 baños,47 m² útiles,Inglaterra/ Vicuna Mackenna Ponien...
En Arriendo A Estrenar 1 Dormitorio 1 Baño Froilan Roa,$350.000,1 dormitorio,1 baño,30 m² útiles,"Froilan Roa - Departamental, La Fl..."
Arriendo/ Walker Martínez / Juan De Pineda,$490.000,2 dormitorios,2 baños,49 m² útiles,"Juan De Pineda, La Florida"
En Arriendo Metro Mirador 1 Dormitorio,$360.000,1 dormitorio,1 baño,40 m² útiles,Vicuña Mackenna Poniente - Metro M...
Departamento En Arriendo 2 Dorm. La Florida,$580.000,2 dormitorios,2 baños,60 m² útiles,Av. La Florida Con Calle San Jorge...
Hermoso Departamento Con Patio Tranquila Calle La Florida,$700.000,2 dormitorios,2 baños,63 m² útiles,"Uruguay 8866, Santiago, La Florida..."
Dos Habitaciones Grandes/r.magallanes/ A. La Florida,$600.000,2 dormitorios,2 baños,75 m² útiles,Rojas Magallanes / Avenida La Flor...
Arriendo Dpto 2d+2b+b+e La Florida,$480.000,2 dormitorios,2 baños,57 m² útiles,La Florida
Depto En Arriendo De 3 Dorm. En Plaza Vespucio,$520.000,3 dormitorios,2 baños,60 m² útiles,Mall Plaza Vespucio/ Paso El Roble...
Arriendo/ Depto 2d Barcelona/ Metro Mirador,$460.000,2 dormitorios,2 baños,61 m² útiles,Arriendo/ Depto D Barcelona/ Metro...
Arriendo Depto 2d / Metro Mirador,$460.000,2 dormitorios,2 baños,54 m² útiles,"Arriendo Depto D / Metro Mirador, ..."
Arriendo Depto. 2d / Lo Cañas / Hualle Norte,$550.000,2 dormitorios,2 baños,58 m² útiles,Arriendo Depto. D / Lo Cañas / Hua...
Arriendo Depto 2d / Andalién / Palena,$500.000,2 dormitorios,2 baños,70 m² útiles,Arriendo Depto. D / Andalién/ Pale...
Arriendo Depto. 2d / Orompello / Palena,$420.000,2 dormitorios,2 baños,60 m² útiles,Arriendo Depto. D / Orompello / Pa...
"Se Arrienda Dpto. 3d 2b, Cercano A 2 Metros, La Florida",$495.000,3 dormitorios,2 baños,62 m² útiles,Vicuña Mackena Entre Metro Elisa C...
Calle Lia Aguirre 155- 50% Dscto Primer Mes 150.000 Pesos,$300.000,1 dormitorio,1 baño,32 m² útiles,Calle Lia Aguirre 155- La Florida ...
Departamento En Arriendo De 2 Dorm. En La Florida,$500.000,2 dormitorios,2 baños,55 m² útiles,"Rodríguez Velasco, Vicente Valdés,..."
"Arriendo Departamento 2dorm,2baños, Estac Y Bdega - Nuevo",$520.000,2 dormitorios,2 baños,58 m² útiles,"El Hualle, Lo Cañas - Alto Macul, ..."
Calle La Concepcion 7663-metrovicente Valdes 2d+2b+estac+bod,$500.000,2 dormitorios,2 baños,56 m² útiles,Calle La Concepcion 7663 Edificio ...
Calle La Concepcion 7663-metrovicente Valdes 2d+2b+estac+bod,$570.000,2 dormitorios,2 baños,56 m² útiles,Calle La Concepcion 7663 Edificio ...
Arrienda Hermoso Dpto En La Florida,$360.000,1 dormitorio,34 m² útiles,No disponible,"Vicuña Mackenna Metro Mirador, Met..."
Departamento En Arriendo De 2 Dorm. En Santiago,$452.000,2 dormitorios,2 baños,60 m² útiles,Miguel De Olivares /lord Cochanne ...
Departamento En Arriendo De 2 Dorm. En La Florida,$465.000,2 dormitorios,2 baños,40 m² útiles,Juan De Pineda Con Walker Martinez...
Departamento En Arriendo De 2 Dorm. En La Florida,$440.000,2 dormitorios,1 baño,42 m² útiles,Av . Vicuña Mackenna Poniente / Me...
Metro Mirador Dos Amplios Ambientes Terraza Cercano Comercio,$310.000,1 dormitorio,1 baño,40 m² útiles,"Av. Vicuña Mackenna 6300 - 6600, L..."
Departamento En Arriendo De 2 Dorm. 1 Baño En La Florida,$430.000,2 dormitorios,1 baño,No disponible,"Depto 2 Habitaciones, 1 Baño Juan ..."
Departamento En Arriendo De 3 Dorm. En La Florida,$470.000,3 dormitorios,2 baños,63 m² útiles,Vicuña Mackena - José Miguel Carre...
Se Arrienda Departamento 2 Dormitorios 1 Baño,$340.000,2 dormitorios,1 baño,43 m² útiles,"Metro Bellavista La Florida, Plaza..."
,$370.000,1 dormitorio,1 baño,39 m² útiles,Se Arrienda Depto Casi Nuevo 1d 1b...
Pudeto 6579 Metro Mirador - Garantía En 3 Cuotas,$410.000,2 dormitorios,1 baño,48 m² útiles,"Pudeto 6579 Metro Mirador, Plaza V..."
Arriendo Departamento Frente  Mall Florida Center,$390.000,1 dormitorio,1 baño,35 m² útiles,"Condominio Mirador Del Parque, Met..."
,$350.000,1 dormitorio,1 baño,35 m² útiles,50% Desc. 1er Mes De Arriendo Y Ga...
!!! Con Promoción¡¡¡  Se Arrienda Lindo Depto En La Florida,$500.000,3 dormitorios,2 baños,80 m² útiles,"Cercano A Metro Vicente Valdes, Vi..."
"Amplio Depto De 3d,2b Con Estac Y Bodega En Colombia",$550.000,3 dormitorios,2 baños,80 m² útiles,"Cercano A Metro Vicente Valdes, Vi..."
Depto. 1 Dormitorio,$350.000,1 dormitorio,1 baño,32 m² útiles,"Walker Martínez - Calle Colombia, ..."
"Departamento Nuevo, Uruguay Con Rojas Magallanes.-",$500.000,2 dormitorios,2 baños,64 m² útiles,"Uruguay Con Rojas Magallanes.-, Ro..."
,$350.000,1 dormitorio,1 baño,30 m² útiles,Dpto 1d + 1b + Est- Froilan Roa Co...
,$400.000,1 dormitorio,1 baño,35 m² útiles,"Departamental Con Vespucio, Plaza ..."
,$650.000,3 dormitorios,2 baños,58 m² útiles,"Santa Victoria 9448, La Florida Al..."
,$450.000,1 dormitorio,1 baño,31 m² útiles,Dpto Amoblado 1d + 1b - A Pasos De...
Arriendo Dos Dormitorios Buena Distribución,$450.000,2 dormitorios,1 baño,70 m² útiles,Excelente Ubicación Dos Dormitorio...
Departamento Con Excelente Conectividad En La Florida,$550.000,3 dormitorios,2 baños,60 m² útiles,"Depto La Florida Diego Portales, L..."
"Arriendo Dpto Nuevo, 2d/2b Estacionamiento Y Bodega",$500.000,2 dormitorios,2 baños,52 m² útiles,Arriendo Frente A Metro Hernando D...
Amplio Y Lindo Depto En Arriendo -3d -2b- 1bod,$600.000,3 dormitorios,2 baños,77 m² útiles,"Metro Mirador, Plaza Vespucio, La ..."
Arriendo De Elegante Departamento En La Florida,$580.000,2 dormitorios,2 baños,57 m² útiles,Se Arrienda Departamento / La Conc...
Arriendo Departamento La Florida,$490.000,2 dormitorios,1 baño,50 m² útiles,Avenida Trinidad /avenida La Flori...
Cómodo Y Amplio Departamento En Arriendo,$450.000,2 dormitorios,1 baño,60 m² útiles,"San Jorge Con Colombia, Los Quilla..."
Metro Vicente Valdes,$450.000,2 dormitorios,2 baños,55 m² útiles,"Metro Vicente Valdes, Vicente Vald..."
3d/2b Amoblado $650.000 Sta. Victoria/rojas Magallanes,$650.000,3 dormitorios,2 baños,59 m² útiles,"Santa Victoria/rojas Magallanes, L..."
,$500.000,3 dormitorios,2 baños,61 m² útiles,Precioso Departamento En Mall Plaz...
Arriendo Depto. 1d-1b Mall Plaza Vespucio,$350.000,1 dormitorio,1 baño,34 m² útiles,"Metro Bellavista De La Florida, Pl..."
Gran Oportunidad De Arriendo,$320.000,1 dormitorio,1 baño,31 m² útiles,"Froilán Lagos Sepúlveda 1500, Edif..."
Departamento En Arriendo De 2 Dorm. En La Florida,$520.000,2 dormitorios,2 baños,57 m² útiles,"Llanquihue 6290, Metro Mirador, La..."
Arriendo Depto. En La Florida 1d 1b 1bodega Edif. Todo Lujo,$350.000,1 dormitorio,1 baño,30 m² útiles,"Pudeto 6908, Plaza Vespucio, La Fl..."
Arriendo Depto. 1d 1b En La Florida Edificio Nuevo De Lujo,$335.000,1 dormitorio,1 baño,30 m² útiles,"Pudeto 6908, Plaza Vespucio, La Fl..."
Departamento En Arriendo De 2 Dorm. En La Florida,$530.000,2 dormitorios,2 baños,52 m² útiles,"Frente Al Mim / Metro L5, Plaza Ve..."
Departamento Arriendo 2 Dormitorios 2 Baños 1 Est La Florida,$470.000,2 dormitorios,2 baños,60 m² útiles,"Vicuña Mackenna 115400, Los Quilla..."
Arriendo Departamento 3 Dormitorios 2 Baños 1 E La Florida,$540.000,3 dormitorios,2 baños,75 m² útiles,"Vicuña Mackenna 115400, Los Quilla..."
Dpto. Arriendo 1 Dorm.terraza&#43;bd Y Estac. En Metro Mirad,$380.000,1 dormitorio,1 baño,40 m² útiles,"Metro Mirador, Plaza Vespucio, La ..."
Departamento En Arriendo De 2 Dorm. En La Florida,$420.000,2 dormitorios,2 baños,51 m² útiles,Barcelona Con Vicuña Mackenna Orie...
Departamento En Arriendo De 2 Dorm. En La Florida,$450.000,2 dormitorios,2 baños,55 m² útiles,"Vespucio / Froilán Roa, Plaza Vesp..."
Arriendo Hermoso Dpto Con Patio En Barrio Atto De La Florida,$850.000,3 dormitorios,2 baños,85 m² útiles,Avenida Alto Macul Con Camino Del ...
Edificio Antonia (1 Est. 1 Bod.) Vista Norte Piso 7,$290.000,1 dormitorio,1 baño,31 m² útiles,"Fresia 6955, Plaza Vespucio, La Fl..."
Edificio Vicuña Urban Vista Norte Piso 16,$350.000,1 dormitorio,1 baño,31 m² útiles,"Av. Vicuña Mackenna Pte. 6650, Pla..."
Edificio Vicuña Urban Vista Poniente Piso 16,$335.000,1 dormitorio,1 baño,28 m² útiles,"Av. Vicuña Mackenna Pte. 6650, Pla..."
Edificio Lofty Vista Poniente Piso 14,$310.000,1 dormitorio,1 baño,28 m² útiles,"Av. Vicuña Mackenna Ote. 6711, Pla..."
Edificio Barcelona Vista Suroriente Piso 14,$345.000,1 dormitorio,1 baño,33 m² útiles,"Barcelona 160, Plaza Vespucio, La ..."
Edificio Activa Vicuña Mackenna Poniente Vista Norte Piso,$370.000,1 dormitorio,1 baño,34 m² útiles,"Av. Vicuña Mackenna Pte. 6315, Met..."
Edificio Activa Vicuña Mackenna Poniente Vista Norte Piso,$350.000,1 dormitorio,1 baño,34 m² útiles,"Av. Vicuña Mackenna Pte. 6315, Met..."
Edificio San Carlos Vista Sur Piso 6,$310.000,1 dormitorio,1 baño,24 m² útiles,"San Carlos De Ancud 74, Plaza Vesp..."
Edificio San Carlos Vista Norte Piso 8,$305.000,1 dormitorio,1 baño,28 m² útiles,"San Carlos De Ancud 74, Plaza Vesp..."
Edificio Lofty Vista Poniente Piso 13,$355.000,1 dormitorio,1 baño,31 m² útiles,"Av. Vicuña Mackenna Ote. 6711, Pla..."
Edificio Nueva Cuatro (1 Est. 1 Bod.) Vista Poniente Piso 9,$475.000,1 dormitorio,1 baño,59 m² útiles,"Nueva Cuatro 6277, Plaza Vespucio,..."
Edificio Torres De Vicuña Mackenna Vista Oriente Piso 13,$275.000,1 dormitorio,1 baño,22 m² útiles,"Av. Vicuña Mackenna Pte. 6456, Met..."
360.000 Dpto Arr 1d1b La Florida Metro Mirador,$350.000,1 dormitorio,1 baño,35 m² útiles,"Metro Mirador, Metro Mirador, La F..."
Edificio Mirador Azul Vista Norte Piso 3,$485.000,2 dormitorios,2 baños,59 m² útiles,"Vicuña Mackenna Poniente 6239, Met..."
Edificio Vicuña Urban Vista Oriente Piso 17,$345.000,1 dormitorio,1 baño,35 m² útiles,"Av. Vicuña Mackenna Pte. 6650, Pla..."
Edificio Vicuña Urban Vista Sur Piso 5,$405.000,2 dormitorios,1 baño,42 m² útiles,"Av. Vicuña Mackenna Pte. 6650, Pla..."
Edificio Torres De Vicuña Mackenna Vista Oriente Piso 13,$375.000,2 dormitorios,1 baño,40 m² útiles,"Av. Vicuña Mackenna Pte. 6456, Met..."
Edificio Lofty Vista Nororiente Piso 8,$530.000,2 dormitorios,2 baños,55 m² útiles,"Av. Vicuña Mackenna Ote. 6711, Pla..."
Edificio Lofty Vista Poniente Piso 14,$300.000,1 dormitorio,1 baño,27 m² útiles,"Av. Vicuña Mackenna Ote. 6711, Pla..."
Edificio Lofty Vista Nororiente Piso 6,$555.000,2 dormitorios,2 baños,55 m² útiles,"Av. Vicuña Mackenna Ote. 6711, Pla..."
Edificio Lofty Vista Surponiente Piso 8,$540.000,2 dormitorios,2 baños,55 m² útiles,"Av. Vicuña Mackenna Ote. 6711, Pla..."
Edificio Lofty Vista Oriente Piso 16,$480.000,2 dormitorios,2 baños,42 m² útiles,"Av. Vicuña Mackenna Ote. 6711, Pla..."
Edificio Mirador Azul (1 Est. 1 Bod.) Vista Sur Piso 13,$339.000,1 dormitorio,1 baño,34 m² útiles,"Vicuña Mackenna Poniente 6239, Met..."
Arriendo Departamento1dormitorio1baño. Metro Bellavista,$330.000,1 dormitorio,1 baño,40 m² útiles,"Bellavista Plaza Vespucio, Plaza V..."
Edificio Mirador Capital Vista Nororiente Piso 13,$360.000,1 dormitorio,1 baño,31 m² útiles,"Av. Vicuña Mackenna Ote. 6197, Met..."
Edificio Mirador Capital Vista Nororiente Piso 3,$360.000,1 dormitorio,1 baño,30 m² útiles,"Av. Vicuña Mackenna Ote. 6197, Met..."
Edificio Torres De Vicuña Mackenna Vista Oriente Piso 18,$330.000,1 dormitorio,1 baño,28 m² útiles,"Av. Vicuña Mackenna Pte. 6456, Met..."
Edificio Antonia Vista Oriente Piso 5,$315.000,1 dormitorio,1 baño,31 m² útiles,"Fresia 6955, Plaza Vespucio, La Fl..."
Departamento En Arriendo De 3 Dorm. En La Florida,$850.000,3 dormitorios,2 baños,85 m² útiles,Avenida Alto Macul Con Camino Del ...
Dpto 2d2b Moderno Estac Metro Vicente Valdez La Florida,$520.000,2 dormitorios,2 baños,58 m² útiles,"Vicente Valdez, Vicente Valdés, La..."
Dpto 1d 1b 1b Colombia 7584 La Florida,$340.000,1 dormitorio,1 baño,31 m² útiles,"Colombia 7584, Vicente Valdés, La ..."
Departamento En Arriendo De 2 Dorm. En La Florida,$550.000,2 dormitorios,2 baños,51 m² útiles,"Vicuña Mackenna, Rojas Magallanes,..."
Departamento A Estrenar En Arriendo De 2 Dorm. En La Florida,$650.000,2 dormitorios,1 baño,4.048 m² útiles,"Bellavista 7150, Plaza Vespucio, L..."
"Oportunidad, Metro Mirador, Depto. En Calle Pudeto",$300.000,1 dormitorio,1 baño,35 m² útiles,"Pudeto Con Barcelona, Plaza Vespuc..."
Dpto Nuevo Arriendo 1d Con Estac Y Bod 415.000 Metro Mirador,$415.000,1 dormitorio,1 baño,30 m² útiles,"Metro Mirador, La Florida"
Edificio Lia Aguirre Vista Sur Piso 6,$250.000,1 dormitorio,1 baño,16 m² útiles,"Lia Aguirre 95, Plaza Vespucio, La..."
Edificio Vicuña Mackenna Oriente Vista Poniente Piso 2,$350.000,1 dormitorio,1 baño,34 m² útiles,"Vicuña Mackenna Oriente 7492, Plaz..."
"Lindo Departamento , Calle Pudeto , Metro Mirador",$290.000,1 dormitorio,1 baño,45 m² útiles,"Vicuña Mackenna Oriente, Metro Mir..."
Departamento En Arriendo De 2 Dorm. En La Florida,$430.000,2 dormitorios,2 baños,55 m² útiles,"Walker Martinez, Vicente Valdés, L..."
"50%dscto1 Mescanon1d&#43;1b,eb Opcional Lago Pirihueico La F",$290.000,1 dormitorio,1 baño,31 m² útiles,"50%dscto 1 Mescanon1d&#43;1b,eb Op..."
"Metro Mirador, 1dorm, 1bañ, 1bod, Pudeto/ Barcelona",$300.000,1 dormitorio,1 baño,35 m² útiles,"Pudeto Con Barcelona, Plaza Vespuc..."
Departamento En Arriendo De 2 Dorm. En La Florida,$400.000,2 dormitorios,2 baños,57 m² útiles,"Punta Arenas 6600, Plaza Vespucio,..."
Departamento En Arriendo De 1 Dorm. En La Florida,$320.000,1 dormitorio,1 baño,No disponible,"Vicuña Mackenna Poniente 7189, Pla..."
Departamento En Arriendo De 2 Dorm. En La Florida S/estac.,$400.000,2 dormitorios,1 baño,No disponible,Vicente Valdes A Pasos De Avda Vic...
Departamento En Arriendo De 2d 2b 1e. Mall Plaza Vespucio,$450.000,2 dormitorios,2 baños,50 m² útiles,"Cercano A Mall Plaza Vespucio, Pla..."
Departamento En La Florida,$450.000,2 dormitorios,2 baños,50 m² útiles,"Cercano A Mall Plaza Vespucio, Pla..."
Departamento En Arriendo De 1 Dorm. En La Florida,UF11,1 dormitorio,1 baño,42 m² útiles,"Las Acacias, Vicente Valdés, La Fl..."
Arriendo Departamento En La Florida,$660.000,3 dormitorios,2 baños,70 m² útiles,"Av. Vicuña Mackenna, La Florida, R..."
"Depto. 2 D 1 B, Con Estacionamiento Y Bodega",$415.000,2 dormitorios,1 baño,43 m² útiles,"Frente Al Mim / Punta Arenas, Plaz..."
Arriendo Depto Nuevo Con Linda Vista,$440.000,2 dormitorios,2 baños,51 m² útiles,"Nueva Cuatro, 6277, Plaza Vespucio..."
"Renovado! 2d 2b, Metro Mirador, Plaza Vespucio",$450.000,2 dormitorios,2 baños,46 m² útiles,"Vicuña Mackenna Poniente, 6600 - 6..."
Departamento 1d&#43;1b Av.vicuña Mackenna Oriente #6617 Flor,$410.000,1 dormitorio,1 baño,33 m² útiles,"Barcelona, Plaza Vespucio, La Flor..."
"Precioso Dpto. Nuevo 2d/1b, Metro Bellavista",$420.000,2 dormitorios,1 baño,41 m² útiles,"Metro Bellavista / Florida Center,..."
"Precioso Dpto. Nuevo 1d/1b, Metro Bellavista",$320.000,1 dormitorio,1 baño,32 m² útiles,"Metro Bellavista / Florida Center,..."
Departamento 1d&#43;1b Av. Vicuña Mackenna Oriente #6617 Flo,$300.000,1 dormitorio,1 baño,32 m² útiles,"Barcelona, Plaza Vespucio, La Flor..."
Departamento En Arriendo De 1 Dorm. En La Florida,$430.000,1 dormitorio,1 baño,35 m² útiles,"Barcelona, Plaza Vespucio, La Flor..."
Departamento En Arriendo En La Florida,$420.000,2 dormitorios,2 baños,52 m² útiles,"Frente Al Mim / Punta Arenas, Plaz..."
Departamento 1d&#43;1b Avenida Vicuña Mackenna Oriente 6617,$175.000,1 dormitorio,1 baño,32 m² útiles,"Barcelona, Plaza Vespucio, La Flor..."
Departamento De 1d&#43;1b Av. Vicuña Mackenna Oriente 6617,$175.000,1 dormitorio,1 baño,33 m² útiles,"Barcelona, Plaza Vespucio, La Flor..."
"Departamento 2 D 2 B, Con Estacionamiento Y Bodega",$500.000,2 dormitorios,2 baños,52 m² útiles,"Frente Al Mim / Metro Mirador, Pla..."
"Departamento Arriendo 2 D - 1 B La Florida, Estac Y Bodega",$400.000,2 dormitorios,1 baño,41 m² útiles,"Frente Al Mim / Metro L5, Plaza Ve..."
Departamento En Arriendo De 2 Dorm. En La Florida,$570.000,2 dormitorios,2 baños,60 m² útiles,"Metro Vicente Valdes, Vicente Vald..."
"La Florida, 3d, 2b (53164)",$430.000,3 dormitorios,2 baños,60 m² útiles,"3d, 2b La Florida, J.m.carrera, Sa..."
"Departamento Arriendo De 2 Dorm. En La Florida, Est Y Bodega",$420.000,2 dormitorios,2 baños,49 m² útiles,"Frente Al Mim / Punta Arenas, Plaz..."
"Gran Oportunidad Dpto La Florida, Cerca Del Metro",$300.000,1 dormitorio,1 baño,29 m² útiles,"Barcelona 1 - 300, 160, Plaza Vesp..."
"Dpto. 2d2b Nuevo Piso 16, La Concepción 7663, La Florida.",$570.000,2 dormitorios,2 baños,45 m² útiles,"Metro Vicente Valdes, Vicente Vald..."
"Dpto. 2d2b Nuevo Piso 13, La Concepción 7663, La Florida.",$570.000,2 dormitorios,2 baños,41 m² útiles,"Metro Vicente Valdes, Vicente Vald..."
"Arriendo En La Florida, 2 D 1 B Con Estacionamiento Y Bodega",$400.000,2 dormitorios,1 baño,41 m² útiles,"Frente Al Mim / Punta Arenas, Plaz..."
"Departamento En Arriendo En La Florida, 1 D 1 B, Piscina",$340.000,1 dormitorio,1 baño,33 m² útiles,"Frente Al Mim / Punta Arenas, Plaz..."
Departamento En Arriendo De 1 Dorm. En La Florida,$170.000,1 dormitorio,1 baño,30 m² útiles,"Metro Vicente Valdes, Vicente Vald..."
Departamento En Arriendo De 3 Dorm. En La Florida,$600.000,3 dormitorios,2 baños,7.210 m² útiles,"Avenida Vicuña Mackenna 9060, Metr..."
Departamento En Arriendo De 1 Dorm. En La Florida,$190.000,1 dormitorio,1 baño,32 m² útiles,"Avenida Vicuña Mackenna, Vicente V..."
Departamento 1d&#43;1b&#43;b Rodriguez De Velasco #10 La Flo,$190.000,1 dormitorio,1 baño,34 m² útiles,"Avenida Vicuña Mackenna, Vicente V..."
Departamento En Arriendo De 2 Dorm. En La Florida,$550.000,2 dormitorios,2 baños,6.034 m² útiles,"Av. Vicuña Mackenna Nº9060, Metro ..."
Metro Vicente Valdes / Americo Vespucio (46709),$400.000,2 dormitorios,2 baños,55 m² útiles,"Lia Aguirre # 155 / 2d 1 B, Plaza ..."
2 Dorm. &#43; 2 Baños Con Estacionamiento Y Bodega,$550.000,2 dormitorios,2 baños,60 m² útiles,Walker Martínez / Av. La Florida /...
Departamento Nuevo En Arriendo De 2 Dorm. En La Florida,$520.000,2 dormitorios,2 baños,66 m² útiles,"Av. Vicuña Mackenna Nº9060, A Paso..."
Rodriguez Velasco # 10 / Vicuña Mackenna (57604),$368.000,2 dormitorios,1 baño,50 m² útiles,Rodriguez Velasco # 10 // Vicent V...
"Dpto 2d2b Nuevo Piso 18, Lía Aguirre 155, La Florida.",$380.000,2 dormitorios,2 baños,49 m² útiles,"Metro Bellavista De La Florida, Pl..."
Se Arrienda Dep 2d2b1e1bod La Florida (55832),$510.000,2 dormitorios,2 baños,49 m² útiles,Se Arrienda Dep 2d2b1e1bod La Flor...
Departamento En Arriendo De 2 Dorm. En La Florida,$420.000,2 dormitorios,2 baños,55 m² útiles,Metro Vicente Valdes / Corazon De ...
"Cómodo Y Estratégico Dpto. 1d/1b, Mall Plaza Vespucio",$280.000,1 dormitorio,1 baño,32 m² útiles,Mall Plaza Vespucio / Metro Bellav...
Departamento En Arriendo En La Florida,$330.000,1 dormitorio,1 baño,34 m² útiles,Metro Vicente Valdes / Las Acacias...
Departamento En Arriendo En La Florida,$315.000,1 dormitorio,1 baño,34 m² útiles,Metro Vicente Valdes / Las Acacias...
Departamento En Arriendo En La Florida,$520.000,2 dormitorios,1 baño,56 m² útiles,"Mall Mirador, Metro Mirador, La Fl..."
Depto.en Arriendo De 1 Dorm. En Metro Mirador La Florida,$375.000,1 dormitorio,1 baño,33 m² útiles,Av. Vicuña Mackenna Oriente/mall F...
Depto 4d+3b+estac Y Bod Colombia- W. Martinez,$580.000,4 dormitorios,3 baños,100 m² útiles,"Colombia 7200 - 7500, La Florida"
"2d+2b Punta Arenas 6600/ Atahualpa, Metro Mirador.",$370.000,2 dormitorios,2 baños,60 m² útiles,"Av. Punta Arenas 6600, Plaza Vespu..."
Departamento En Arriendo De 2d-2b En La Florida,$550.000,2 dormitorios,2 baños,55 m² útiles,"Mall Plaza Vespucio, Plaza Vespuci..."
Depto 2d-2b Arriendo En La Florida-mall Plaza Vespucio,$470.000,2 dormitorios,2 baños,42 m² útiles,"Mall Plaza Vespucio, Plaza Vespuci..."
Departamento En Arriendo De 2 Dorm. Y 2 Baños En La Florida,UF11,2 dormitorios,2 baños,45 m² útiles,Desde Metro Mirador Esta Cerca Cam...
"Depto Arriendo 1 Dorm, 1 Baño Edif Torres Vicuña La Florida",$282.000,1 dormitorio,1 baño,22 m² útiles,Av. Vicuña Mackenna Poniente/calle...
Depto. Arriendo 1 D 1b. Edif. Torre Vicuña/metro Mirador,$290.000,1 dormitorio,1 baño,29 m² útiles,Av. Vicuña Mackenna Poniente/calle...
"Depto. Arriendo 2 Dorm, 2 Baños Metro Mirador/la Florida",$433.000,2 dormitorios,2 baños,40 m² útiles,Vicuña Poniente/calle Mirador Azul...
"Depto En Arriendo 2 Dorm. 2 Baños, Metro Mirador/la Florida",$475.000,2 dormitorios,2 baños,45 m² útiles,Metro Mirador/mall Florida Center/...
Maravilloso Depto 3 Dor 2 Baños Walker Martinez La Florida,$430.000,3 dormitorios,2 baños,54 m² útiles,"Walker Martínez 1000, La Florida, ..."
"Depto Arriendo 2dorm, 1b Edif Torre Vicuña Macke. La Florida",$384.000,2 dormitorios,1 baño,38 m² útiles,Av.vicuña Mackenna Poniente/calle ...
Depto Arriendo 1dorm 1 Baño Metro Mirador/ La Florida,$350.000,1 dormitorio,1 baño,34 m² útiles,Calle Mirador Azul/vicuña Mackenna...
